{
  "bundleId": "portable:v4:dabea6a38d1da4941fd186c1b425f66a14b52d1c698ab457432dda5080644723",
  "data": {
    "cognitionEvidence": [
      {
        "cognitionId": "cog-1",
        "evidenceId": "ev-1",
        "relation": "support"
      }
    ],
    "cognitionTargets": [],
    "cognitionTransitions": [],
    "cognitions": [
      {
        "archivedAt": null,
        "askedAt": null,
        "confidence": 600,
        "content": "用户喜欢 X",
        "contentType": "preference",
        "createdAt": "2026-01-01T00:00:03.000Z",
        "credStatus": "limited",
        "formedBy": "stated",
        "id": "cog-1",
        "invalidAt": null,
        "mutedAt": null,
        "scope": null,
        "subjectId": "owner",
        "updatedAt": "2026-01-01T00:00:03.000Z",
        "validAt": null
      }
    ],
    "entities": [],
    "eventEvidence": [
      {
        "eventId": "evt-1",
        "evidenceId": "ev-1"
      },
      {
        "eventId": "evt-1",
        "evidenceId": "ev-2"
      }
    ],
    "events": [
      {
        "consolidated": true,
        "createdAt": "2026-01-01T00:00:02.000Z",
        "id": "evt-1",
        "occurredAt": "2026-01-01T00:00:00.000Z",
        "subjectId": "owner",
        "summary": "一个事件"
      }
    ],
    "evidence": [
      {
        "allowCloudRead": false,
        "allowInference": true,
        "allowLocalRead": true,
        "correctsEvidenceId": null,
        "deletedAt": null,
        "hostId": "local",
        "id": "ev-1",
        "occurredAt": "2026-01-01T00:00:00.000Z",
        "originId": null,
        "rawContent": "原话 ev-1",
        "recordedAt": "2026-01-01T00:00:01.000Z",
        "sourceKind": "spoken",
        "subjectId": "owner",
        "summary": "摘要 ev-1"
      },
      {
        "allowCloudRead": false,
        "allowInference": true,
        "allowLocalRead": true,
        "correctsEvidenceId": null,
        "deletedAt": null,
        "hostId": "local",
        "id": "ev-2",
        "occurredAt": "2026-01-01T00:00:00.000Z",
        "originId": null,
        "rawContent": "原话 ev-2",
        "recordedAt": "2026-01-01T00:00:01.000Z",
        "sourceKind": "tool",
        "subjectId": "owner",
        "summary": "摘要 ev-2"
      }
    ],
    "interactionContexts": [
      {
        "context": [
          {
            "content": "hi",
            "role": "user"
          }
        ],
        "contextHash": "b03d228fdf33e7c81a9a7ea3eadadcf2cdcb98823fe93c669b8f0db42e0fa8a0",
        "conversationId": "conv-1",
        "createdAt": "2026-01-01T00:00:00.500Z",
        "episodeId": "ep-1",
        "id": "ic-1",
        "subjectId": "owner"
      }
    ],
    "relationshipEvidence": [],
    "relationships": [],
    "retractions": [],
    "semanticResolutions": [],
    "unconsolidatedEventIds": [],
    "worldEventEvidence": [],
    "worldEvents": [],
    "worldItemLifecycle": []
  },
  "exportedAt": "2026-01-02T00:00:00.000Z",
  "format": "memoweft-bundle",
  "memoWeftVersion": "0.6.0-dev",
  "metadata": {
    "counts": {
      "cognitionTransitions": 0,
      "cognitions": 1,
      "entities": 0,
      "events": 1,
      "evidence": 2,
      "relationships": 0,
      "retractions": 0,
      "worldEvents": 0,
      "worldItemLifecycle": 0
    },
    "notes": [
      "fixture"
    ]
  },
  "schemaVersion": 4,
  "source": {
    "exportMode": "full",
    "hostId": "local"
  },
  "sourceSubjectId": "owner",
  "subjectId": "owner",
  "worldRevision": 0,
  "worldSnapshotHash": ""
}
